{
  "schema_version": "v1",
  "strategy_id": "breakout_trend",
  "name": "Breakout Trend",
  "description": "Enter when close breaks above the prior 20-close high and exit when close breaks below the prior 10-close low.",
  "strategy_type": "rule_based",
  "position_mode": "long_only",
  "market": {
    "symbol": "QQQ",
    "timeframe": "1d"
  },
  "indicators": [
    {
      "id": "high_20",
      "kind": "rolling_high",
      "inputs": {
        "source": "close",
        "length": 20
      }
    },
    {
      "id": "low_10",
      "kind": "rolling_low",
      "inputs": {
        "source": "close",
        "length": 10
      }
    }
  ],
  "entry": {
    "when": "all",
    "conditions": [
      {
        "left": {
          "price": "close"
        },
        "operator": "gt",
        "right": {
          "indicator": "high_20"
        }
      }
    ]
  },
  "exit": {
    "when": "all",
    "conditions": [
      {
        "left": {
          "price": "close"
        },
        "operator": "lt",
        "right": {
          "indicator": "low_10"
        }
      }
    ]
  }
}
